{
  "schema_version": 3,
  "candidate_id": "v2-daily-rc-example",
  "candidate_commit": "0000000000000000000000000000000000000000",
  "source_candidate_dir": "artifacts/v2-daily/replace-with-ci-bundle",
  "source_manifest_path": "artifacts/v2-daily/replace-with-ci-bundle/RELEASE_MANIFEST.json",
  "source_manifest_sha256": "0000000000000000000000000000000000000000000000000000000000000000",
  "build_receipt_path": "artifacts/v2-daily/replace-with-ci-bundle/BUILD_RECEIPT.json",
  "build_receipt_sha256": "0000000000000000000000000000000000000000000000000000000000000000",
  "workflow_run_url": "https://github.com/replace/replace/actions/runs/1",
  "android_ime_path": "artifacts/v2-daily/replace-with-signed-ime.apk",
  "android_ime_sha256": "0000000000000000000000000000000000000000000000000000000000000000",
  "android_ime_apksigner_report_path": "artifacts/v2-daily/replace-with-ime-apksigner.txt",
  "android_ime_apksigner_report_sha256": "0000000000000000000000000000000000000000000000000000000000000000",
  "android_runtime_path": "artifacts/v2-daily/replace-with-signed-runtime.apk",
  "android_runtime_sha256": "0000000000000000000000000000000000000000000000000000000000000000",
  "android_runtime_apksigner_report_path": "artifacts/v2-daily/replace-with-runtime-apksigner.txt",
  "android_runtime_apksigner_report_sha256": "0000000000000000000000000000000000000000000000000000000000000000",
  "android_signing_cert_sha256": "0000000000000000000000000000000000000000000000000000000000000000",
  "desktop_executable_path": "artifacts/v2-daily/replace-with-signed-desktop.exe",
  "desktop_executable_sha256": "0000000000000000000000000000000000000000000000000000000000000000",
  "windows_package_path": "artifacts/v2-daily/replace-with-signed-windows-package.zip",
  "windows_package_sha256": "0000000000000000000000000000000000000000000000000000000000000000",
  "windows_installer_path": "artifacts/v2-daily/replace-with-signed-installer.exe",
  "windows_installer_sha256": "0000000000000000000000000000000000000000000000000000000000000000",
  "windows_authenticode_report_path": "artifacts/v2-daily/replace-with-authenticode-report.json",
  "windows_authenticode_report_sha256": "0000000000000000000000000000000000000000000000000000000000000000",
  "windows_signing_thumbprint": "0000000000000000000000000000000000000000",
  "android_manual_pass": false,
  "windows_manual_pass": false,
  "otp_manual_pass": false,
  "seven_day_daily_use_pass": false,
  "license_and_notices_approved": false,
  "owner_approved": false,
  "owner_name": "replace-with-owner-name",
  "decision_at_utc": "1970-01-01T00:00:00Z",
  "evidence_location": "replace-with-redacted-evidence-location"
}
